{
  "N": 4,
  "auth": {
    "credential_ref": "WCB_KIMI_KEY",
    "method": "api-key"
  },
  "billing": "metered",
  "config_id": "kimi-k3-eff-high--api--official--dev",
  "effort": "high",
  "family": "kimi",
  "m": {
    "min": 4,
    "q": 4
  },
  "model_id": "kimi-k3",
  "protocol": "api",
  "served_model": "kimi-k3",
  "telemetry": {
    "completion_tokens": 60212,
    "cost_usd": null,
    "prompt_tokens": 3096,
    "total_tokens": 63308,
    "wall_ms": 1727967
  },
  "transport": "moonshot-official-api",
  "vendor_sanction_ref": null
}
